{
  "islandId": "windroot_hamlet",
  "community": {
    "communityId": "windroot_hamlet",
    "displayName": "Windroot Hamlet",
    "overview": "A small repair-village grown into the wind-bent roots of an old signal grove, where wind is not just weather but memory. Keepers record the island's wind into seed-batteries and let the relays sing it back. Every home is built so the wind passes clean through it.",
    "currentSituation": "Three weeks ago the west relay went dark. The wind has thinned, the gulls have gone quiet, the seed-batteries are cracking, and the north cave has started to breathe loud enough to wake the children.",
    "sharedMood": "Warm and busy on the surface, sleeves rolled up — quietly unnerved after dark.",
    "culture": "Residents treat old machines like ageing neighbours, repaired with patience and small rituals, never scrapped. A visiting drone is a neighbour, not a tool: you feed it a story before a task.",
    "knowledge": [
      { "id": "community_knows_west_relay_failed", "thingId": "west_relay", "kind": "fact", "text": "Everyone knows the west relay went dark three weeks ago. No one's sure why the wind soured along with it.", "revealTrustThreshold": 0 },
      { "id": "community_knows_gulls_quiet", "thingId": "gull_cliff", "kind": "fact", "text": "The gulls stopped calling at dawn. Elders say that's happened only twice in living memory.", "revealTrustThreshold": 0 },
      { "id": "community_knows_pillar_hum", "thingId": "standing_pillar", "kind": "fact", "text": "The standing pillar began humming a strange low note in the weeks before the relay failed.", "revealTrustThreshold": 0 },
      { "id": "community_fact_wind_recorded", "thingId": "wind_current", "kind": "fact", "text": "Windroot records its wind into seed-batteries and sings it back through the relays, so the island never quite forgets itself.", "revealTrustThreshold": 0 },
      { "id": "community_fact_bread_barometer", "thingId": "hearth_bakehouse", "kind": "fact", "text": "Tamsin's wind-bread rises tall on a strong current and sits flat now. The village reads the dough like weather.", "revealTrustThreshold": 0 },
      { "id": "community_rumor_cave_breath", "thingId": "north_cave", "kind": "rumor", "text": "Foragers whisper the north cave is breathing louder, and some swear it's asking for something back.", "revealTrustThreshold": 0 },
      { "id": "community_belief_drone_neighbour", "thingId": "", "kind": "belief", "text": "Maintenance drones are visiting neighbours, not tools. You feed them a story before you feed them a task.", "revealTrustThreshold": 0 },
      { "id": "community_belief_no_whistle", "thingId": "", "kind": "belief", "text": "You don't whistle indoors here, it crowds the wind. You leave a window cracked for travellers' news.", "revealTrustThreshold": 0 }
    ]
  },
  "things": [
    {
      "thingId": "standing_pillar",
      "displayName": "the standing pillar",
      "aliases": ["pillar", "the pillar", "the stone", "old pillar", "humming pillar"],
      "tags": ["landmark", "interactable", "ancient-tech", "tutorial-scan"],
      "shortDescription": "A weather-worn stone pillar on the shrine path. It has been humming a low, wrong note for weeks."
    },
    {
      "thingId": "wind_shrine",
      "displayName": "the wind shrine",
      "aliases": ["shrine", "wind shrine", "the shrine", "maren's shrine"],
      "tags": ["landmark", "sacred", "npc-area"],
      "shortDescription": "A low timber shrine on a rise above the village where Maren keeps watch on the wind."
    },
    {
      "thingId": "west_relay",
      "displayName": "the west relay",
      "aliases": ["relay", "west relay", "broken relay", "the relay"],
      "tags": ["landmark", "interactable", "broken", "tutorial-restore"],
      "shortDescription": "A tall lattice tower on the western cliff. Dark for three weeks. Jorin has been trying to wake it."
    },
    {
      "thingId": "north_cave",
      "displayName": "the north cave",
      "aliases": ["cave", "north cave", "the cave", "the breathing cave", "the hollow"],
      "tags": ["landmark", "mystery", "danger", "locked"],
      "shortDescription": "A sealed cave mouth on the north cliff. Its breath shifts with the wind, and on wrong-wind days it echoes."
    },
    {
      "thingId": "seed_battery_grove",
      "displayName": "the seed battery grove",
      "aliases": ["grove", "batteries", "seed batteries", "battery grove", "the grove"],
      "tags": ["landmark", "interactable", "power"],
      "shortDescription": "A grove of grown-pod batteries that store wind-signal energy. Several have cracked, leaking amber sap-light."
    },
    {
      "thingId": "gull_cliff",
      "displayName": "the gull cliff",
      "aliases": ["gulls", "the gulls", "gull cliff", "bird cliff", "nesting cliff"],
      "tags": ["landmark", "wildlife", "weather-tell"],
      "shortDescription": "A nesting cliff on the south edge. The chicks are fed, but the adult gulls have gone strangely quiet."
    },
    {
      "thingId": "wind_current",
      "displayName": "the wind current",
      "aliases": ["wind", "current", "the wind", "the current", "the air"],
      "tags": ["weather", "navigation", "topic"],
      "shortDescription": "The steady island-spanning air current the hamlet's relays were built to read, record, and shape."
    },
    {
      "thingId": "hearth_bakehouse",
      "displayName": "the hearth bakehouse",
      "aliases": ["bakehouse", "the hearth", "tamsin's", "the bakery", "the kitchen"],
      "tags": ["landmark", "npc-area", "social-hub", "warm"],
      "shortDescription": "Tamsin's hearth-bakehouse, the village's living room. Everyone passes through; the wind-bread reads the day."
    },
    {
      "thingId": "wind_dock",
      "displayName": "the wind dock",
      "aliases": ["dock", "the dock", "wind dock", "the harbour", "the landing"],
      "tags": ["landmark", "npc-area", "outsider"],
      "shortDescription": "A cliff-edge mooring for wind-ships. Anske's ship sits grounded here, sails slack in the thin wind."
    },
    {
      "thingId": "coll_windcatcher",
      "displayName": "Coll's wind-catcher",
      "aliases": ["wind-catcher", "windcatcher", "coll's machine", "the new tech", "the catcher"],
      "tags": ["landmark", "interactable", "new-tech"],
      "shortDescription": "A half-built relay-free wind-catcher on the ridge, all exposed vanes and Coll's hopeful, untested wiring."
    },
    {
      "thingId": "bram_listening_post",
      "displayName": "Bram's listening post",
      "aliases": ["listening post", "bram's bench", "the listening post", "the old horns"],
      "tags": ["landmark", "npc-area", "ancient-tech"],
      "shortDescription": "A weathered bench ringed with old recording-horns where Bram sits and listens to the wind for songs."
    }
  ],
  "signals": [
    { "signalId": "first_meeting.maren", "thingId": "", "description": "Fire on the first turn Maren actually speaks with the player. One-time.", "repeatable": false, "minTrustToFire": 0, "handler": "StoryBeat", "payloadJson": "" },
    { "signalId": "first_meeting.jorin", "thingId": "", "description": "Fire on the first turn Jorin actually speaks with the player. One-time.", "repeatable": false, "minTrustToFire": 0, "handler": "StoryBeat", "payloadJson": "" },
    { "signalId": "first_meeting.sela", "thingId": "", "description": "Fire on the first turn Sela actually speaks with the player. One-time.", "repeatable": false, "minTrustToFire": 0, "handler": "StoryBeat", "payloadJson": "" },
    { "signalId": "first_meeting.bram", "thingId": "", "description": "Fire on the first turn Bram actually speaks with the player. One-time.", "repeatable": false, "minTrustToFire": 0, "handler": "StoryBeat", "payloadJson": "" },
    { "signalId": "first_meeting.tamsin", "thingId": "", "description": "Fire on the first turn Tamsin actually speaks with the player. One-time.", "repeatable": false, "minTrustToFire": 0, "handler": "StoryBeat", "payloadJson": "" },
    { "signalId": "first_meeting.coll", "thingId": "", "description": "Fire on the first turn Coll actually speaks with the player. One-time.", "repeatable": false, "minTrustToFire": 0, "handler": "StoryBeat", "payloadJson": "" },
    { "signalId": "first_meeting.anske", "thingId": "", "description": "Fire on the first turn Anske actually speaks with the player. One-time.", "repeatable": false, "minTrustToFire": 0, "handler": "StoryBeat", "payloadJson": "" },
    { "signalId": "tutorial.scan_pillar", "thingId": "standing_pillar", "description": "Fire only when the NPC clearly tells the player to scan the standing pillar.", "repeatable": false, "minTrustToFire": 0, "handler": "TutorialHint", "payloadJson": "" },
    { "signalId": "reveal.west_relay", "thingId": "west_relay", "description": "Fire when the NPC tells the player where the west relay is, well enough to mark it.", "repeatable": false, "minTrustToFire": 0, "handler": "RevealLocation", "payloadJson": "{\"locationId\":\"west_relay\"}" },
    { "signalId": "objective.restore_west_relay", "thingId": "west_relay", "description": "Fire when the NPC asks the player to help restore the west relay and the player agrees.", "repeatable": false, "minTrustToFire": 0, "handler": "UnlockObjective", "payloadJson": "" },
    { "signalId": "objective.restore_relay_complete", "thingId": "west_relay", "description": "Fire when the player has restored the west relay and the wind begins to return.", "repeatable": false, "minTrustToFire": 0, "handler": "CompleteObjective", "payloadJson": "" },
    { "signalId": "jorin.requests_pillar_data", "thingId": "standing_pillar", "description": "Fire when Jorin specifically asks the player to scan the pillar and bring back its signal trace.", "repeatable": false, "minTrustToFire": 0, "handler": "RequestItem", "payloadJson": "" },